{
  "scheme": "zeropay",
  "displayName": "ZeroPay",
  "country": [
    "KR"
  ],
  "category": "bank_transfer",
  "standard": "Seoul Metropolitan Government ZeroPay common QR",
  "parserVersion": "0.1.0",
  "maturity": "community",
  "identification": "generic",
  "supported": true,
  "nonPayment": false,
  "lastVerified": "2026-10-02",
  "supports": {
    "amount": true,
    "merchant": true,
    "currency": true,
    "dynamic": true
  },
  "references": [
    "https://www.zeropay.or.kr"
  ]
}
