{
  "scheme": "twqr",
  "displayName": "TWQR",
  "country": [
    "TW"
  ],
  "category": "bank_transfer",
  "standard": "Taiwan EMVCo-based common QR code",
  "parserVersion": "0.1.0",
  "maturity": "community",
  "identification": "generic",
  "supported": true,
  "nonPayment": false,
  "lastVerified": "2026-10-02",
  "supports": {
    "amount": true,
    "merchant": true,
    "currency": true,
    "dynamic": true
  },
  "references": [
    "https://www.emvco.com/emv-technologies/qr-codes/"
  ]
}
