{
  "scheme": "x_money",
  "displayName": "X Money",
  "country": [],
  "category": "payment_link",
  "standard": "Public X profile link (account handle only)",
  "parserVersion": "0.1.0",
  "maturity": "beta",
  "identification": "heuristic",
  "supported": true,
  "nonPayment": false,
  "lastVerified": "2026-10-02",
  "supports": {
    "amount": false,
    "merchant": false,
    "currency": false,
    "dynamic": false
  },
  "references": [
    "https://help.x.com/en/using-x/qr-codes"
  ]
}
