{
  "scheme": "mercado_pago",
  "displayName": "Mercado Pago / Transferencias 3.0",
  "country": [
    "AR"
  ],
  "category": "bank_transfer",
  "standard": "BCRA Transferencias 3.0 interoperable QR (EMVCo QRCPS, Comunicacion A 6425)",
  "parserVersion": "0.1.0",
  "maturity": "community",
  "identification": "generic",
  "supported": true,
  "nonPayment": false,
  "lastVerified": "2026-10-02",
  "supports": {
    "amount": true,
    "merchant": true,
    "currency": true,
    "dynamic": true
  },
  "references": [
    "https://www.bcra.gob.ar"
  ]
}
