{
  "scheme": "nqr",
  "displayName": "NQR",
  "country": [
    "NG"
  ],
  "category": "bank_transfer",
  "standard": "CBN/NIBSS Nigeria Quick Response Code (EMV QR Code Specification, Merchant-Presented Mode)",
  "parserVersion": "0.1.0",
  "maturity": "community",
  "identification": "generic",
  "supported": true,
  "nonPayment": false,
  "lastVerified": "2026-10-02",
  "supports": {
    "amount": true,
    "merchant": true,
    "currency": true,
    "dynamic": true
  },
  "references": [
    "https://www.cbn.gov.ng/out/2021/ccd/framework%20for%20quick%20response%20(qr)%20code%20payments%20in%20nigeria.pdf",
    "https://nibss-plc.com.ng/nqr/"
  ]
}
