{
  "scheme": "qris",
  "displayName": "QRIS",
  "country": [
    "ID"
  ],
  "category": "bank_transfer",
  "standard": "Bank Indonesia / ASPI Quick Response Code Indonesian Standard",
  "parserVersion": "0.1.0",
  "maturity": "beta",
  "identification": "exact",
  "supported": true,
  "nonPayment": false,
  "lastVerified": "2026-10-02",
  "supports": {
    "amount": true,
    "merchant": true,
    "currency": true,
    "dynamic": true
  },
  "references": [
    "https://www.bi.go.id/en/fungsi-utama/sistem-pembayaran/ritel/kanal-layanan/qris/default.aspx"
  ]
}
