{
  "scheme": "upi",
  "displayName": "UPI",
  "country": [
    "IN"
  ],
  "category": "bank_transfer",
  "standard": "UPI deep link v1",
  "parserVersion": "0.1.0",
  "maturity": "stable",
  "identification": "exact",
  "supported": true,
  "nonPayment": false,
  "lastVerified": "2026-10-02",
  "supports": {
    "amount": true,
    "merchant": true,
    "currency": true,
    "dynamic": true
  },
  "references": [
    "https://www.npci.org.in/PDF/npci/upi/circular/2017/Circular18_BankCompliances_to_enbaleUPIMerchantecosystem_0.pdf"
  ]
}
