{
  "scheme": "tron",
  "displayName": "TRON",
  "country": [],
  "category": "crypto",
  "standard": "TRON Base58Check address",
  "parserVersion": "0.1.0",
  "maturity": "beta",
  "identification": "exact",
  "supported": true,
  "nonPayment": false,
  "lastVerified": "2026-10-02",
  "supports": {
    "amount": false,
    "merchant": false,
    "currency": false,
    "dynamic": false
  },
  "references": [
    "https://tronprotocol.github.io/documentation-en/mechanism-algorithm/account/"
  ]
}
