{
  "scheme": "ton",
  "displayName": "TON",
  "country": [],
  "category": "crypto",
  "standard": "TON user-friendly address",
  "parserVersion": "0.1.0",
  "maturity": "beta",
  "identification": "exact",
  "supported": true,
  "nonPayment": false,
  "lastVerified": "2026-10-02",
  "supports": {
    "amount": false,
    "merchant": false,
    "currency": false,
    "dynamic": false
  },
  "references": [
    "https://docs.ton.org/v3/documentation/smart-contracts/addresses/address-formats"
  ]
}
