{
  "scheme": "swiss_qr_bill",
  "displayName": "Swiss QR-bill",
  "country": [
    "CH",
    "LI"
  ],
  "category": "bank_transfer",
  "standard": "SIX Swiss Implementation Guidelines QR-bill v2.x",
  "parserVersion": "0.1.0",
  "maturity": "experimental",
  "identification": "exact",
  "supported": true,
  "nonPayment": false,
  "lastVerified": "2026-10-02",
  "supports": {
    "amount": true,
    "merchant": true,
    "currency": true,
    "dynamic": false
  },
  "references": [
    "https://www.six-group.com/en/products-services/banking-services/payment-standardization/standards/qr-bill.html"
  ]
}
