{
  "scheme": "mmqr",
  "displayName": "MMQR",
  "country": [
    "MM"
  ],
  "category": "bank_transfer",
  "standard": "Myanmar QR Code Specification for Retail Payments",
  "parserVersion": "0.1.0",
  "maturity": "community",
  "identification": "generic",
  "supported": true,
  "nonPayment": false,
  "lastVerified": "2026-10-02",
  "supports": {
    "amount": true,
    "merchant": true,
    "currency": true,
    "dynamic": true
  },
  "references": [
    "https://myanmarpay.com.mm/frontend/assets/files/MyanmarQRSpecification.pdf"
  ]
}
