{
  "scheme": "interac",
  "displayName": "Interac e-Transfer",
  "country": [
    "CA"
  ],
  "category": "payment_link",
  "standard": "Interac e-Transfer QR link",
  "parserVersion": "0.1.0",
  "maturity": "beta",
  "identification": "exact",
  "supported": true,
  "nonPayment": false,
  "lastVerified": "2026-09-20",
  "supports": {
    "amount": false,
    "merchant": false,
    "currency": false,
    "dynamic": false
  },
  "references": [
    "https://www.interac.ca/en/interac-e-transfer/"
  ]
}
