{
  "scheme": "revolut",
  "displayName": "Revolut",
  "country": [
    "GB"
  ],
  "category": "payment_link",
  "standard": "Public Revolut.Me link",
  "parserVersion": "0.1.0",
  "maturity": "beta",
  "identification": "exact",
  "supported": true,
  "nonPayment": false,
  "lastVerified": "2026-10-02",
  "supports": {
    "amount": true,
    "merchant": false,
    "currency": true,
    "dynamic": false
  },
  "references": [
    "https://www.revolut.com/revolut-me/"
  ]
}
