{
  "scheme": "lankaqr",
  "displayName": "LankaQR",
  "country": [
    "LK"
  ],
  "category": "bank_transfer",
  "standard": "Central Bank of Sri Lanka LankaQR specification",
  "parserVersion": "0.1.0",
  "maturity": "community",
  "identification": "generic",
  "supported": true,
  "nonPayment": false,
  "lastVerified": "2026-10-02",
  "supports": {
    "amount": true,
    "merchant": true,
    "currency": true,
    "dynamic": true
  },
  "references": [
    "https://www.cbsl.gov.lk/en/LANKAQR"
  ]
}
