{
  "scheme": "duitnow_qr",
  "displayName": "DuitNow QR",
  "country": [
    "MY"
  ],
  "category": "bank_transfer",
  "standard": "PayNet DuitNow QR Merchant-Presented Mode specification",
  "parserVersion": "0.1.0",
  "maturity": "beta",
  "identification": "exact",
  "supported": true,
  "nonPayment": false,
  "lastVerified": "2026-10-02",
  "supports": {
    "amount": true,
    "merchant": true,
    "currency": true,
    "dynamic": true
  },
  "references": [
    "https://docs.developer.paynet.my/docs/duitNow-QR/introduction/overview"
  ]
}
