{
  "scheme": "vipps",
  "displayName": "Vipps",
  "country": [
    "NO"
  ],
  "category": "payment_link",
  "standard": "Vipps QR redirect link",
  "parserVersion": "0.1.0",
  "maturity": "beta",
  "identification": "exact",
  "supported": true,
  "nonPayment": false,
  "lastVerified": "2026-10-02",
  "supports": {
    "amount": false,
    "merchant": false,
    "currency": false,
    "dynamic": true
  },
  "references": [
    "https://developer.vippsmobilepay.com/"
  ]
}
