{
  "scheme": "wechat_pay",
  "displayName": "WeChat Pay",
  "country": [
    "CN"
  ],
  "category": "wallet",
  "standard": "Proprietary (WeChat Pay)",
  "parserVersion": "0.1.0",
  "maturity": "experimental",
  "identification": "heuristic",
  "supported": false,
  "nonPayment": false,
  "lastVerified": "2026-10-02",
  "supports": {
    "amount": false,
    "merchant": false,
    "currency": false,
    "dynamic": false
  },
  "references": [
    "https://pay.weixin.qq.com/"
  ]
}
